{
  "semester": 1,
  "subject": "Business Statistics and Logic",
  "faculty": ["Prof. Karan Kachhadiya", "Prof. Birju Patil"],
  "questions": [
    {
      "id": "bstat-u1-q1",
      "questionNumber": "Q.1",
      "questionText": "Explain the meaning and definition of Statistics. Also explain its functions, scope and limitations.",
      "marks": 7,
      "unit": "Unit 1",
      "type": "detail",
      "answer": [
        {
          "blockType": "heading",
          "text": "Meaning and Definition of Statistics"
        },
        {
          "blockType": "paragraph",
          "text": "Statistics is the branch of applied mathematics that deals with the collection, organization, analysis, interpretation and presentation of numerical data.",
          "spans": [
            { "start": 0, "end": 10, "style": "underline" }
          ]
        },
        {
          "blockType": "subheading",
          "text": "Definition (Horace Secrist)"
        },
        {
          "blockType": "paragraph",
          "text": "Statistics may be defined as the aggregate of facts affected to a marked extent by multiplicity of causes, numerically expressed, collected in a systematic manner for a predetermined purpose.",
          "spans": [
            { "start": 0, "end": 10, "style": "italic" }
          ]
        },
        {
          "blockType": "heading",
          "text": "Functions of Statistics"
        },
        {
          "blockType": "list",
          "listStyle": "roman",
          "items": [
            { "text": "Presents facts in a definite form.", "spans": [] },
            { "text": "Simplifies complex data into an understandable form.", "spans": [] },
            { "text": "Helps in formulating and testing hypotheses.", "spans": [{ "start": 20, "end": 30, "style": "underline" }] },
            { "text": "Helps in forecasting future trends." }
          ]
        },
        {
          "blockType": "heading",
          "text": "Scope of Statistics"
        },
        {
          "blockType": "paragraph",
          "text": "The scope of Statistics extends to almost every field including economics, business, medicine and social sciences."
        },
        {
          "blockType": "heading",
          "text": "Limitations of Statistics"
        },
        {
          "blockType": "list",
          "listStyle": "decimal",
          "items": [
            { "text": "Statistics does not deal with individual items, only aggregates." },
            { "text": "It cannot study qualitative characteristics directly." },
            { "text": "Statistical results are true only on average, not for every case." }
          ]
        }
      ]
    },
    {
      "id": "bstat-u1-q2",
      "questionNumber": "Q.2",
      "questionText": "Define Statistics.",
      "marks": 2,
      "unit": "Unit 1",
      "type": "short",
      "answer": [
        {
          "blockType": "paragraph",
          "text": "Statistics is the science of collecting, organizing, analyzing and interpreting numerical data.",
          "spans": [
            { "start": 0, "end": 10, "style": "underline" }
          ]
        }
      ]
    }
  ]
}
